{
  "schema_version": "1.0.0",
  "dataset_id": "m3_1_review_candidates",
  "annotation_status": "unverified",
  "repositories": [
    {
      "repo_id": "micrograd",
      "revision": "7bc720e951fe422b8f8814aa5aa1b64121d26b4c",
      "source": "local micrograd checkout",
      "split": "unassigned"
    },
    {
      "repo_id": "reposage",
      "revision": "f26e2ec824bd8d41f673a547e388b82c4ccdaf6a",
      "source": "RepoSage repository test fixtures",
      "split": "unassigned"
    }
  ],
  "indexes": [],
  "tasks": [
    {
      "task_id": "backward",
      "repo_id": "micrograd",
      "intent": "Find the reverse traversal and gradient propagation",
      "evidence": [
        {
          "evidence_id": "backward-0",
          "file": "micrograd/engine.py",
          "symbol": "Value.backward",
          "line_start": 54,
          "line_end": 70,
          "role": "answer",
          "review": {
            "status": "unverified",
            "reviewers": [],
            "decisions": []
          },
          "coverage": {
            "status": "not_checked",
            "index_manifest": null,
            "matching_chunks": []
          }
        },
        {
          "evidence_id": "backward-1",
          "file": "micrograd/engine.py",
          "symbol": "Value",
          "line_start": 2,
          "line_end": 94,
          "role": "context",
          "review": {
            "status": "unverified",
            "reviewers": [],
            "decisions": []
          },
          "coverage": {
            "status": "not_checked",
            "index_manifest": null,
            "matching_chunks": []
          }
        }
      ],
      "review": {
        "status": "unverified",
        "reviewers": [],
        "decisions": []
      }
    },
    {
      "task_id": "mlp_forward",
      "repo_id": "micrograd",
      "intent": "Find how the MLP sends an input through layers",
      "evidence": [
        {
          "evidence_id": "mlp_forward-0",
          "file": "micrograd/nn.py",
          "symbol": "MLP.__call__",
          "line_start": 51,
          "line_end": 54,
          "role": "answer",
          "review": {
            "status": "unverified",
            "reviewers": [],
            "decisions": []
          },
          "coverage": {
            "status": "not_checked",
            "index_manifest": null,
            "matching_chunks": []
          }
        },
        {
          "evidence_id": "mlp_forward-1",
          "file": "micrograd/nn.py",
          "symbol": "MLP",
          "line_start": 45,
          "line_end": 60,
          "role": "context",
          "review": {
            "status": "unverified",
            "reviewers": [],
            "decisions": []
          },
          "coverage": {
            "status": "not_checked",
            "index_manifest": null,
            "matching_chunks": []
          }
        }
      ],
      "review": {
        "status": "unverified",
        "reviewers": [],
        "decisions": []
      }
    },
    {
      "task_id": "auth",
      "repo_id": "reposage",
      "intent": "Find credential lookup and password verification",
      "evidence": [
        {
          "evidence_id": "auth-0",
          "file": "backend/tests/fixtures/sample_repo/auth.py",
          "symbol": "authenticate_user",
          "line_start": 7,
          "line_end": 32,
          "role": "answer",
          "review": {
            "status": "unverified",
            "reviewers": [],
            "decisions": []
          },
          "coverage": {
            "status": "not_checked",
            "index_manifest": null,
            "matching_chunks": []
          }
        },
        {
          "evidence_id": "auth-1",
          "file": "backend/tests/fixtures/sample_repo/auth.py",
          "symbol": "get_user_from_db",
          "line_start": 35,
          "line_end": 38,
          "role": "context",
          "review": {
            "status": "unverified",
            "reviewers": [],
            "decisions": []
          },
          "coverage": {
            "status": "not_checked",
            "index_manifest": null,
            "matching_chunks": []
          }
        }
      ],
      "review": {
        "status": "unverified",
        "reviewers": [],
        "decisions": []
      }
    },
    {
      "task_id": "pagination",
      "repo_id": "reposage",
      "intent": "Find pagination bounds and returned metadata",
      "evidence": [
        {
          "evidence_id": "pagination-0",
          "file": "backend/tests/fixtures/sample_repo/utils.py",
          "symbol": "paginate",
          "line_start": 21,
          "line_end": 47,
          "role": "answer",
          "review": {
            "status": "unverified",
            "reviewers": [],
            "decisions": []
          },
          "coverage": {
            "status": "not_checked",
            "index_manifest": null,
            "matching_chunks": []
          }
        }
      ],
      "review": {
        "status": "unverified",
        "reviewers": [],
        "decisions": []
      }
    },
    {
      "task_id": "relu",
      "repo_id": "micrograd",
      "intent": "Find the rectified activation and its gradient",
      "evidence": [
        {
          "evidence_id": "relu-0",
          "file": "micrograd/engine.py",
          "symbol": "Value.relu",
          "line_start": 45,
          "line_end": 52,
          "role": "answer",
          "review": {
            "status": "unverified",
            "reviewers": [],
            "decisions": []
          },
          "coverage": {
            "status": "not_checked",
            "index_manifest": null,
            "matching_chunks": []
          }
        }
      ],
      "review": {
        "status": "unverified",
        "reviewers": [],
        "decisions": []
      }
    }
  ],
  "queries": [
    {
      "query_id": "backward-en",
      "task_id": "backward",
      "pair_id": "backward",
      "category": "en",
      "identifier_presence": "present",
      "text": "How does Value.backward traverse the graph and propagate gradients?",
      "spans": [
        {
          "start": 0,
          "end": 8,
          "text": "How does",
          "label": "en"
        },
        {
          "start": 9,
          "end": 23,
          "text": "Value.backward",
          "label": "code"
        },
        {
          "start": 24,
          "end": 67,
          "text": "traverse the graph and propagate gradients?",
          "label": "en"
        }
      ],
      "exact_symbols": [
        "Value.backward"
      ],
      "review": {
        "status": "unverified",
        "reviewers": [],
        "decisions": []
      }
    },
    {
      "query_id": "backward-fr",
      "task_id": "backward",
      "pair_id": "backward",
      "category": "fr",
      "identifier_presence": "present",
      "text": "Comment Value.backward parcourt-il le graphe et propage-t-il les gradients ?",
      "spans": [
        {
          "start": 0,
          "end": 7,
          "text": "Comment",
          "label": "fr"
        },
        {
          "start": 8,
          "end": 22,
          "text": "Value.backward",
          "label": "code"
        },
        {
          "start": 23,
          "end": 76,
          "text": "parcourt-il le graphe et propage-t-il les gradients ?",
          "label": "fr"
        }
      ],
      "exact_symbols": [
        "Value.backward"
      ],
      "review": {
        "status": "unverified",
        "reviewers": [],
        "decisions": []
      }
    },
    {
      "query_id": "backward-zh",
      "task_id": "backward",
      "pair_id": "backward",
      "category": "zh",
      "identifier_presence": "present",
      "text": "Value.backward 如何遍历计算图并传播梯度？",
      "spans": [
        {
          "start": 0,
          "end": 14,
          "text": "Value.backward",
          "label": "code"
        },
        {
          "start": 15,
          "end": 28,
          "text": "如何遍历计算图并传播梯度？",
          "label": "zh"
        }
      ],
      "exact_symbols": [
        "Value.backward"
      ],
      "review": {
        "status": "unverified",
        "reviewers": [],
        "decisions": []
      }
    },
    {
      "query_id": "backward-en-fr",
      "task_id": "backward",
      "pair_id": "backward",
      "category": "en-fr",
      "identifier_presence": "present",
      "text": "How does Value.backward parcourir le graphe et calculer les gradients ?",
      "spans": [
        {
          "start": 0,
          "end": 8,
          "text": "How does",
          "label": "en"
        },
        {
          "start": 9,
          "end": 23,
          "text": "Value.backward",
          "label": "code"
        },
        {
          "start": 24,
          "end": 71,
          "text": "parcourir le graphe et calculer les gradients ?",
          "label": "fr"
        }
      ],
      "exact_symbols": [
        "Value.backward"
      ],
      "review": {
        "status": "unverified",
        "reviewers": [],
        "decisions": []
      }
    },
    {
      "query_id": "backward-en-zh",
      "task_id": "backward",
      "pair_id": "backward",
      "category": "en-zh",
      "identifier_presence": "present",
      "text": "How does Value.backward 遍历计算图并传播梯度？",
      "spans": [
        {
          "start": 0,
          "end": 8,
          "text": "How does",
          "label": "en"
        },
        {
          "start": 9,
          "end": 23,
          "text": "Value.backward",
          "label": "code"
        },
        {
          "start": 24,
          "end": 35,
          "text": "遍历计算图并传播梯度？",
          "label": "zh"
        }
      ],
      "exact_symbols": [
        "Value.backward"
      ],
      "review": {
        "status": "unverified",
        "reviewers": [],
        "decisions": []
      }
    },
    {
      "query_id": "backward-fr-zh",
      "task_id": "backward",
      "pair_id": "backward",
      "category": "fr-zh",